work_id;title;author;rating;category;fandom;relationship;character;additional tags;language;published;status;status date;words;chapters;comments;kudos;bookmarks;hits;all_kudos;all_bookmarks
38722188;Monstrous May 2022;['driftingloon'];Explicit;F/F, F/M, Gen, M/M, Multi, Other;Original Work, Ancient Greek Religion & Lore;Ash Holliday/Doppelganger, Acid the Centipede/Johnny Parker, Satyr/Original Male Character, Troll/Daisy Underwood, Amihan Reyes/Shadow Monsters, Jude Leota/The Fairy, Elijah Blau/Wraith, Beelzebub/Angel, Mercury/Jupiter, The King/Raoul Cristobal, Amber Wyatt/The Beast of the Smaragdos Wilds, Asterion the Minotaur/Bronte;Ilona Goethe, Ash Holliday, Johnny Parker, Acid the Centipede, Artemis Boone, Briar Robins, Daisy Underwood, Amihan Reyes, Kayde Green, Luanne Sanderson, Jude Leota, The fairy, Sienna Shrike, Elijah Blau, Beelzebub, Adalia von Schroeder, Mercury, Jupiter - Character, Raoul Cristobal, The King, Amber Wyatt, The Beast of the Smaragdos Wilds, Asterion the Minotaur (Ancient Greek Religion & Lore), Bronte;Vampires, Doppelganger, Forced Pregnancy, Alcohol, Werewolves, Nonbinary Character, Trans Female Character, Trans Male Character, Dragons, Extinction, Zombies, Implied/Referenced Self-Harm, Body Horror, unreality, Painplay;English;01/05/22;Completed;01/06/22;7210;31/31;1;25;;2999;['Judy382951', 'lumarys', 'LiquidYarn', 'Anthony_does_things', 'theleaderofantifa', 'Kiwiboyy1', 'Lee_Baumkuchen', 'Shoeshine', 'Koganusan', 'LostCure', 'smutdrunk'];[]
38985855;Futa Artemis Goddess Of The Hunt;['MagicallyUnhinged'];Explicit;F/F, F/M, M/M, Multi, Other;Percy Jackson and the Olympians - Rick Riordan, Ancient Greek Religion & Lore;;Artemis (Ancient Greek Religion & Lore), Huntresses of Artemis (Ancient Greek Religion & Lore), Apollo (Ancient Greek Religion & Lore), Apollo (Percy Jackson), Zeus (Ancient Greek Religion & Lore), Hades (Percy Jackson), Hades (Ancient Greek Religion & Lore), Cerberus (Ancient Greek Religion & Lore);Futanari, Hermaphrodites, Impregnation, Breeding, End of the World, Mount Olympus (Ancient Greek Religion & Lore), Hunters of Artemis, Lesbian Artemis (Ancient Greek Religion & Lore), Babies, Child Abuse, Age Difference, Underage Sex, Blood and Injury, Blood and Gore, Violence, Rape, Incest;English;14/05/22;Completed;17/05/22;4430;2/2;;139;21;16809;['See_252327', 'Isa_Kiwi_04', 'TuraisAntares616', 'SilverSword12', 'Charlie9F', 'NotYetRedeemed', 'Thespiderharemlover', 'LostInLight', 'StopPertemis', 'YooliaBoolia', 'Colecelot', 'Multifandotakugirl', 'thomasSK', 'Nox_Canem', 'FalconEcosse', 'JER', 'Kez99', 'lesbeanthebean', 'Lupus_Of_Riva', 'AndYetSoBitterSweet', 'Wavyboi638', 'drakonpie250', '600mph', 'coastalmarker99', 'Hellraider', 'delliri', 'Azaroth_69', 'anne_9622', 'Malevolenthoe', 'Kerberos_13', 'LittleRedQueen', 'Phenom92', 'TheChaoticSun'];[]
38717322;smile as bright as the sun as you fade into darkness;['orphan_account'];Teen And Up Audiences;F/M, M/M;Percy Jackson and the Olympians & Related Fandoms - All Media Types, The Trials of Apollo - Rick Riordan, Ancient Greek Religion & Lore;Apollo/Hyacinthus (Percy Jackson), Apollo/Hyacinthus (Ancient Greek Religion & Lore), Apollo/Daphne (Percy Jackson), Apollo/Daphne (Ancient Greek Religion & Lore);Apollo (Percy Jackson), Apollo (Ancient Greek Religion & Lore), Daphne (Percy Jackson), Daphne (Ancient Greek Religion & Lore), Hyacinthus (Percy Jackson), Hyacinthus (Ancient Greek Religion & Lore);Implied/Referenced Rape/Non-con, Rape/Non-con Elements, dont do what apollo did, Is this sad?, Angst, Heavy Angst, Not Beta Read, not alot of dialouge;English;01/05/22;Completed;02/05/22;1337;2/2;;59;1;1420;['Vio_underscore', 'lilytiger98', 'Arwen_alive', 'Nico_Solace64', 'Eyes_Pointed_to_the_Stars', 'ivanie', 'Books_Happiness', 'The_Primordial_Archivist', 'Lonelysummer67', 'talkingishard22', 'GotStabbedByAPen', 'sparkybooklover', 'LioPeggz', 'n1th', 'erororos', 'InternationalImposter', 'corduroy_pants', 'Kanaghfe', 'AzVill', 'Verizonp', 'vaistronomical', 'Hana_H', 'xhsbej', 'Curious_Pizza', '7ove'];[]
25480942;In Love With A Monster;['IcarusxFallen'];Teen And Up Audiences;F/F, Gen, Multi;Ancient Greek Religion & Lore;;Your OC, Medusa, Pegasus, Chrysaor (Ancient Greek Religion & Lore), Poseidon, Zeus, Persephone, Hades, Eurydice wife of Orpheus (Ancient Greek Religion & Lore), Calypso, Briseis;;English;24/07/20;Completed;24/07/20;7247;10/10;;6;;223;['DeputyStarrymountain', 'PancakeCryptid'];[]

47019253;Heracles;['MayaMarkova'];General Audiences;F/M, Gen;Ancient Greek Religion & Lore;Hermes & Prometheus (Ancient Greek Religion & Lore), Hercules | Heracles & Prometheus (Ancient Greek Religion & Lore), Prometheus & Zeus (Ancient Greek Religion & Lore), Hephaestus & Prometheus (Ancient Greek Religion & Lore), Hesione | Pronoia/Prometheus (Ancient Greek Religion & Lore);Prometheus (Ancient Greek Religion & Lore), Hercules | Heracles (Ancient Greek Religion & Lore), Hermes (Ancient Greek Religion & Lore), Hephaestus (Ancient Greek Religion & Lore);;English;07/05/23;Completed;07/05/23;7367;2/2;4;7;1;273;['Engird', 'Coldriver2moon'];[]

